<?xml version="1.0" encoding="UTF-8"?>
<!-- This document contains data on Codifica di Testi aa 20-21.
    Filename: esercizio7_DTDcompleto.xml
    Author: Martina Mele
    LM Informatica Umanistica
    Date: 29/03/2021 
    Esercizio:
        - includere all’interno di un documento XML la dichiarazione del tipo, definire internamente gli elementi e
        gli attributi e validare.
        - inserire nel prologo di un documento XML la dichiarazione del tipo di documento e validare.
        Creare un file esterno con estensione .dtd prima di includerlo nel prologo XML.-->

<!--EXTERNAL DTD-->
<!DOCTYPE TEI SYSTEM "./7c.esercizio7_extDTD.dtd">

<TEI> <!--elemento radice-->

    <body> <!--body può avere una o più occorenze-->
        <div1 type="section"></div1> <!--sibling element-->
        <div2>Questa div contiene solo testo.</div2> <!--sibling element-->
    </body>

    <p type="one">Elemento testuale.</p> <!--p occorre zero o più volte-->
    <p type="two">Elemento testuale.</p>

    <title element="true">Secondo elemento testuale.</title> <!--title può avere una o più occorenze-->

    <text lang="it"> <!--elemento padre, occorre zero o una volta-->
        <figlio><em attribute="title">La Gioconda</em> è un'opera di Leonardo Da Vinci.</figlio>  <!--mixed content-->
    </text>
   

</TEI>